ID,Sentence,RajivJi
1,लोग वतन तक खा जाते हैं इसका इसे यकीन नहींमान जाएगा तू ले जाकर दिल्ली इसे दिखा ला दोस्त,0
5,अंग्रेजी नहीं आती है इसलिए हिन्दी ट्विट ज्यादा करता हूँ । निजी राय बुरा लगे तो भाड़ मे जा |,0
61,तुम गुरु हो कि गुरु घंटाल =D,0
123,हार जाउँगा मुकदमा उस अदालत में ये मुझे यकीन था जहाँ वक्त बन बैठा जज और नसीब मेरा वकील था।,0
268,Dhoni अगर इस्लाम कबूल कर लेते तो उन्हें आज हार का मुँह नहीं देखना पडता,0
363,मेरी सारी कालोनी राशन कार्ड के साथ फिल्म देखने गयी है,0
396,तर्कों की कंगाली ने कांग्रेस को कुतार्कों का मवाली बना दिया है,0
402,हे राम। स्कूल के मासूम बच्चों के सामने इतना ज़हरीला भाषण :(,0
490,Courtesy my friend सोच रहा हूँ। आज रात में दो बोरे अखबार जला दू। पडोसियो पर रेड पडेगा। 😝,0
542,होली से ऐन पहले नतीजे आना ठीक नहीं। सरकार हारे हुए नेताओं को अंग्रेजी दारु की चार बोतलें फ्री भिजवाए,0
985,वाह केजरू वाह,0
1249,अब क्या कहूं ये भौंढा ये संगीत अच्छा है,0
2069,ऐ जिन्दगी तेरे जज्बे को सलाम ! पता है कि मंजिल मौत है ! फिर भी दौड रही है । ! #LifeisBeautiful,0
2091,कुछ मांगने से पहले ख़ूब आज़मा लेना उनको। जान देने की बातों वाले अकसर भाव नहीं देते। #Piyush,0
2154,#AajTakAxisPoll : ग़रीबों को लुभाने में नाकाम रही की न्याय स्कीम है गरीब वोटरों की पहली पसंद। 45%गरीब वोटरों ने @narendramodi को डाले वोट,0
2374,होली के शुरुआती रूझान आने शुरू सीधे हवालात से। Live। Happy Holi। ☺☺☺,0
2407,राजधानी दिल्ली में बदमाशों को ना तो कानून का डर है और ना ही वर्दी का खौफ (@AajGothi),0
3172,10 वर्षों में इतनी तेजी से भवन निर्माण हुआ है कि शहर कंकरीट के जंगल में तबदील होती जा रहा हैं।,0
4082,भाजपा सिर्फ सत्ता की भूखी है।,0
4762,हैरत की बात है कि विभागीय अधिकारी सब कुछ जानते हुए भी अनजान बने हुए हैं।,0
5210,अभिनेत्री गौतमी तड़ीमल्ला से अलग हुए कमल हासन #IndiaHallaBol #HallaBol #Kamal #separated #actress #GautamiTdimala।,0
5216,अभी अभी ख़बर मिली है की ममता के दिल्ली दौरे के बाद उन्हें कई बार टॉलेट में जाके चरस पीते देखा गया है। #MamataAgainstNation,0
5242,"अब तो क्रिसमस में कालेधनी की खूब दिवाली है , मोदी ने छुट दी है कालेधनी को आम आदमी को लूट कर #झूठ_लूट_की_सरकार",0
5243,सीमा पर जवानों को मरने के लिऐ तैनात कर दिया है फिर मौत का जशन मनाने होली दिवाली पर मोदी जी आऐंगे और साथ मे मिडीया भी लाऐंगे #nagrotaattack,0
5255,#Jio50Million दोस्त ने बोला तेरे पास क्या हैं। मेरे पास रिलायन्स जियो हैं। मेरे पास एयरटेल 4G हैं।,0
5258,"अपनी नाकामी का ठीकरा केन्द्र सरकार पर फोड़ने वाला केजरी बताये कि दिल्ली की जनता को कब तक झांसे देता रहेगा, सारे वादे हवा में केजरी गोवा में।",0
5260,"डेंगू, चिकुंगुन्या और प्रदूषित हवा से त्रस्त दिल्ली की जनता एक एक सेकंड का हिसाब आपसे लेगी। बस समय का इंतज़ार करिये।",0
5268,एक बार मायावती की खेती के बारे मेँ गरीब हिंदुस्तानियों को बता दो। एहसान होगा।,0
5271,भक्तों को पहले मोदी ने मारी पीछे से। अब सुनने में आरहा की भक्तों के मौसा डोनाल्ड ट्रंप ने भी मार ली वो भी ऊपर से,0
5274,अभी अभी 4 साल के 5000 जंक मेल डिलीट किये। हिलेरी क्लिंटन टाइप फीलिंग आ रहा है बाईगॉड!,0
5280,रामकिशन यादव उर्फ बाबा रामदेव काणा है अंधो का सरदार बनना चाहा रहा है #BoycottPatanjali,0
5293,कभी धर्म के नाम से डराता है। कभी CBI के नाम से डराता है। अब इनकम टैक्स के नाम से डरा रहा है। #मोदी_फिरकी_ले_रहा_है,0
5295,भिखारी कोई मुझसे पूछ रहा था कि मैं कितना कमा लेता हूँ लेकीन मैं चुप रहा। दूसरा भिखारी क्यों भिखारी मुझे शक था कि वह इनकम टैक्स वाला है,0
5297,"नोटबंदी के बाद देश के 40 शहरों की निकायों ने 13K करोड़ का टैक्स कमाया, पर कुछ जोकरों के पास विरोध करने के सिवाय और कुछ नही है। #MannKiBaat",0
5301,कैशलेस या कार्ड को बिज़नस वालों से इतना विरोध क्यों हो रहा होगा ? कोई भी व्यक्ति अपनी कमाई टैक्स में देना नहीं चाहता ?,0
5305,हद भसड़ मचा रखी है यार बीबीसी ने अब जाकिर नाइक का प्रवक्ता बनकर इस्लामी कानून को हेडलाइन बनाता है,0
5309,यह बात पोरबंदर की कॉस्ट गार्ड है वहां यह जो महिलाएं गर्भवती होती हैं उनको आशा हॉस्पिटल में भेज और वहां के डॉक्टर उनको मरने के,0
5312,"15 साल बाद जनता ने आप को रोजगार दिया, और आपने नोट बंदी कर गरीब जनता को बेरोजगार कर दिया, मोदी जी जनता अगले चुनावों में माफ़ नहीं करेगी !",0
5313,"नोट बंदी से सब ज्यादा फायदा को हुआ है, न विधायकों की गिरफ्तारी हो रही है, न अब दिल्ली में प्रदूषण बचा है, सब कुछ ठीक हो गया",0
5320,नरेन्द्र मोदी रॉबिन हुड बनने की कोशिश कर रहें हैं। अमीरों से छीनकर ग़रीबों में बाँट दो। #खूनीDemonetisation,0
5335,"राहुल गांधी दिमाग का इस्तेमाल करें, कृषि आमदनी अब भी टैक्स मुक्त: जेटली",0
5342,ये अफवाह कौन फैला रहा है कि राहुल गांधी ने रात को सच बोल दिया और उस सच को छिपाने के लिए कांग्रेस को कहना पड़ा पप्पू का अकाउंट हैक हो गया जी,0
5345,अब देखना है राहुल गांधी दलितों के असल चिंतक है या ढोंगी।,0
5356,एक तरफ हम भ्रष्टाचार और काले धन के रास्ते बंद कर रहे हैं तो दूसरी तरफ कुछ लोग भारत बंद की बात कर रहे हैं।,0
5359,खुले में शौच करने वालों खबरदार। देख रहे हैं सलमान खान,0
5384,यक़ीन मानना दोस्तों भारत जैसा महान देश विश्व में कही नहि है क्यूँकि यहाँ रजनीकांत अभिनेता है और अरविंद केजरीवाल अभी भी नेता है,0
5385,जब तक राहुल बाबा का भारतीय जनता पार्टी पर आशीर्वाद रहेगा भाजपा को कोई चिंता करने की जरुरत नहीं है !,0
5387,उत्तर प्रदेश मुख्यमंत्री अखिलेश यादव कितना आशावादी है कि नए नोट में भी भ्रस्टाचार जल्द ही शुरू हो जायेगा,0
5388,हिल चुका है सबका=(सपा+बसपा+कांग्रेस) शासन समय बदलने वाला है आज सुना है अपने दिल से सबको योग कराने वाला योगी आने वाला है। !,0
5391,मौत पर तमाशा करना मजाक बनाना कांग्रेस की पुरानी आदत हैं । जिस सुष्मा ने देश की सेवा मैं कोई कमी नहीं रखी उसकी मौत पर हसना कांग्रेसीओं का हसना नई बात नहीं,0
5392,बंगाली भद्रलोक ने ममता के आने और उसकी बदतमीजी की आशंका से सालों तक मजबूरी में सी। पी। एम। को वोट दिया।,0
5393,सर कल तो हद हो गयी वो सी। पी। एम। में से को मिटा के,0
5394,सेना के देख रेख में चुनाव हो। पर सत्ता मिलते ही क्यों भाव हो! सी। पी। एम। के राज में हर बात के लिए सीबीआई जांच।,0
5397,"अपने काला धन को सफेद न कर पाने के कारण बौखलाए बाबा, ममता बेगम और रामदेव दोनों की मानसिकता एक, बेशुमार काला धन दोनों के पास",0
5405,उसे आदत है मुझे रुला कर सोने की। जिस दिन मेरी आँख ना खुली कसम से नींद से नफ़रत हो जायेगी उसे,0
5411,"लगता है मोदी जी में अफगानिस्तान से उच्च कोटि की अफ़ीम मंगाने की डील कर ली है, अब और ज्यादा रोयेगा ये फ़कीर",0
5420,"अब कितना भी पॉलिश करो, हक़ीक़त यही है श्याम श्वेत। हिलेरी रह गई दाना गिनती, और ट्रंपवा जोत गया खेत।",0
5428,आज शाम कोलकाता की सड़कों पे निकला तो पोस्टर दिखा। दीदी के लिए जीता जगता सबूत। दुकान वाले ने कहा मै 2 घंटे ज्यादा काम करूँगा,0
5451,अमी मोंजुलिका। अमी राजा को मारबो दीदी ने केजरीवाल को भी पीछे छोड़ दिया। जि तो कमालई कर दओ दद्दू,0
5456,"सब गरीब गरीब कर रहे है, कोई उन गरीबों के बारे में भी सोचो जिनके घर का खर्चा न जाने कैसे चल रहा होगा, अम्बानी, अडानी, टाटा, माल्या !",0
5457,टाइम पर्सन ऑफ द इयर : #मोदी टाईम पास ऑफ द इयर : #केजरी,0
5460,आज ओवैशी भूल गया है की उनके पुरब्ज़ ने चाकू छुरी के नोक पर ही अपना धर्म बदला था नोटः ये पुराने गड़ फट्टू है,0
5463,चिंटूओं का एक और झूठ बेनकाब RBI गवर्नर की पत्नी की बहन नहीं हैं नीता अंबानी,0
5494,"जो कंप्यूटर आज तुम्हारा है, वह कल किसी और का था। कल किसी और का होगा और परसों किसी और का होगा। तुम इसे अपना समझ कर क्यों मगन हो । यही खुशी तुम्हारी समस्त परेशानियों का मूल कारण है।",0
5495,हिन्दुस्तान का रुपया अमरीका के डालर के बराबर हो गया और अमरीका ने आइटी का अफरीका के एक एसे देश को दिया जो हिन्दुस्तान से सस्ता है,0
5502,अब तो माल्या से भी सारा बकाया तभी वसूला जा सकता है अगर किसी दिन वो बिना हेलमेट के एक्टिवा चलाते पकड़े जाएं।,0
5503,अब समझा आप हकला क्यों रहे थे। बच्चे नहीं हकलाएँगे तो और कौन हकलाएगा 🙂 #कटाक्ष #व्यंग,0
5504,"अरे कौन कहेता है कि देश का Future देश के युवा है?और अगर है तो Bright Future किसको चाहिए? देश का Future तो वो लोग है, जो Parliament बंध रखके लोगोके घर घर जाकर उनकी सेवामे जूटे है! हमारा देश विकासशील था और रहेगा उसे विकशीत देश की यादी मे लानेकी हमे कोई दिलचस्पी नही है | #कटाक्ष",0
5505,एक आदमी ने एक बाबा की खूब सेवा की ओर उनसे आशीर्वाद मांगा हे बाबा मैं चाहता हूँ कि मेरी मृत्यु राहुल गांधी के प्रधान।,0
5506,कुछ लोग इस बेशर्म को नोबेल प्राइज देने की मांग कर रहे थे,0
5508,कोरोना वैक्सीन के लिए बेजुबान जानवरों पर परीक्षण करने की आवश्यकता क्यों है? बलात्कारी कब काम आएगा? कब तक आप उन्हें मुफ्त।,0
5510,"गलत सिर्फ वही है जो दूसरे कर रहे हो, हम जो स्वयं करते हैं वह सदैव सही होता है, । #thursdaymorning #कटाक्ष",0
5512,जितनी सच्चाई । आपके कथन में होती है। उतनी सच्चाई अपने हृदय में लाएं। न की भाषन में। 🙏 #कटाक्ष समाजिक सच्चाई,0
5525,"याद रखिये। हमें बीमारी से लड़ना है, बीमार से नहीं 😂 #कटाक्ष #यूँही",0
5543,खबरदार जो किसी ने भी दिल्ली का नाम भी लिया तो,0
5544,"गिलगिट बाल्टिस्तान में पाकिस्तान ने बुद्ध की प्रतिमा ध्वस्त किया इस खबर से सभी वाक़िफ़ होंगे पर इसपर कोई उदित राज, कोई।",0
5558,"यहाँ मरते है इंसान युॅ भी इंसान की कीमत कुछ भी नही टैगोर, विवेकानंद की धरती पर बंगाल मे कुछ कीमत ही नही ये अमानवीय।",0
5567,"रुतबा तो खामोशियों का होता है। अल्फ़ाज़ का क्या ? वो तो बदल जाते हैं, अक्सर हालात देखकर।",0
5591,अगर कोई पागल है तो वो है महेश भट्ट इन्हे तत्काल इलाज की जरूरत है आपनी बेटी और उसके दोस्तों को बचाने के लिए अपनी किसी पुरानी कहानी को सुशांत के साथ फिट कर रहा है भक्क 😏😏,0
5592,अगर पांच सालों में दिल्ली अपनी ये दशा भूल जाए तो इससे ज्यादा दुखद और कुछ नही होगा फ्री के चक्कर में पड़ कर ऐसे आदमी को सत्ता सौंप दी जिसने दिल्ली पूरी जला दी चाहे वो दंगों में हो या महामारी में 😰😰 अपने परिवार के साथ घर में रहे सुरक्षित रहें 🙏🏻,0
5620,जिसे मानसिक रूप से ना तोड़ पाओ उसे भावनात्मक रूप से चोट दो यही है मायानगरी की सच्चाई 😡,0
5626,देख लो चमचों ताइवान को भी पूरा भरोसा है की चीन को हरा सकता है तो भारत ही है 🇮🇳 💪🏻,0
6754,"अब ये अफवाह कौन उड़ा रहा, बार वाली, सपना चौधरी से अच्छा डान्स करती है 🤔😂",0
6778,"जो हिन्दू हिंदुत्व का विरोध करते हैं , हमारे यहाँ उसे दोगला कहते हैं, और आप के यहाँ क्या कहते हैं ? 🤔",0
6790,एक बात पूछनी थी हर नई फिल्म शुक्रवार को ही रिलीज क्यु होती है मंगल या शनिवार को क्यु नही जानकार लोग बताएं। 🤔,0
6810,"हिंदुओं में यदि दोगलापन न होता, तो आज भारत मे न कोई आतंकी होता और न इस आतंकी कौम के बारे में जानने की जरूरत होती।",0
6961,"भाई एक ही इलाज है, जो पागल कुत्तो का इलाज होता है, , अब तो आप सब समझ गये होगे। #DefendingTabligi",0
7171,जल्दी करे आभार प्रकट करना है 😊🙏,0
7222,"इनके डीएनए की जांच की जरूरत ही नहीं है, कन्फर्म खराबी है।",0
7253,यह सब चुनाव में होता है बाद तो वो गिरगिट भी जानता है वापस चुनाव आने दो सब भूल जाते हैं।,0
7675,इसको तो उड़ता तीर लेने किसको तो आदत पड़ गई अब,0
7724,वो भाई चुनाव हारने के बाद काफी गहरे सदमे में हैं बाहर निकल कर एक जोर से सांस ले लेता असलियत का पता चल जाता।,0
7773,तुम कितने कोडी के हो जनता जनार्दन जानती हे,0
8404,सही वक्त की चोट के इंतजार में हर कोई सराफत का चोला ओढ़े है यहाँ तब तक रिश्ते निभाते जाइये और मरहम जुटाते जाइये 😒😒,0
8405,"सालों पहले, । कुछ हिन्दू जो कायर थे। उन्होंने। इस्लाम कबूल। कर लिया था। और जो। शेर थे वो धर्म के लिए लडते रहे",0
8411,हाँ हम चुड़ैल किसको बोलते है पता है ना,0
8423,वो तो देदेंगे 2024 में। लेकिन बाद में जो आएगा वो योगी आदित्यनाथ जी होंगे सम्भाल नहीं पाओगे बे।,0
8489,हर विभाग कर्मचारियों की कमी से जूझ रहा है जब तक दुनिया की दूसरी बड़ी प्रशासनिक मशीनरी में मानवीय और भौतिक संसाधनों की पूर्ति नहीं होगा तब तक एक बेड पर दो दो बच्चों का इलाज तो होगा ही इसमें नाराज होने की क्या बात है। #AnjanaOmKashyap,0
8498,देखते हीं देखते ये देश की सबसे बड़ी ब्रेकिंग न्यूज बन जाती है। बरखा और राणा अयूब विदेशी अखबारों में बड़े बड़े आर्टिकल लिखती हैं और नरेन्द्र मोदी की इस प्रचंड जीत को बड़े चालाकी से कट्टरवाद की जीत का तमगा दे दिया जाता है।,0
