ID,Sentence,RajivJi
6733,सालो की आंखे तो खुलती है नही भारत से पंगा लेंगे 💪 #IndianArmyZindabad,1
6741,भाई ये बहत्तर हूरों का बहत्तर हजार से संयोग मात्र ही है ना? #ElectionCongress_72000,1
6749,तारक मेहता के नए एपिसोड नही आ रहे है कहीं अब्दुल को कोरोना तो नहीं हो गया। 😉🤣,1
6756,आपको को क्या लगता है ? सफूरा का पति पहले सामने आएगा या उसका बच्चा ? 🤔😂,1
6761,"जब भाई की बातों को सीरियस नहीं लेते, तो मेरी बातों को क्यों लेते हो~प्रियंकागाँधी 🤣😂",1
6777,"हम तो आत्मनिर्भर उसी दिन हो गये थे, जिस दिन कैटेगरी वाले कालम में जनरल लिखे थे।",1
6780,जो लोग सीमा पर चीन के सैन्य जमावड़े से ज्यादा सफूरा ज़रगर की प्रेगनेंसी में ज्यादा इंटरेस्टेड हैं ? उन्हें क्या कहेंगे आप? 🤔,1
6781,"औवैC ने कहा है की हम कंगना राणावत की मूवीज का बहिष्कार करेंगे। लेकिन हम हिन्दू कितने मूर्ख है की जिहादी शाहरुख, आमिर, सलमान की मूवीज देखते है? 🤔",1
6783,भारत का गृहमंत्री दिल्ली राज्य के अस्पताल की व्यवस्था देखरहा है और दिल्ली का मालिक घर से टीवी। केजरीवाल ऐसा कैसे चलेगा। ? 🤔?,1
6784,ये गर्व से कहते हैं माई नेम इज खान जिस सरनेम की वजह से ये खान गेंग इतराती है उसी सरनेम की वजह से हवाई अड्डों पर इनकी चड्डी तक उतरवाकर इनकी जांच होती है,1
6789,"एक इंसान जो ना पुरुष है, ना स्त्री! उसने खान गैंग के साथ मिलकर पूरे बॉलीवुड का कबाडा कर दिया।",1
6791,"150₹ लीटर पेट्रोल तक तो हम बीजेपी के साथ हैं, उसके ऊपर गया तो भगवान कसम बैटरी वाला स्कूटर लेलेंगे पर वोट तो मोदीजी को ही देंगे। 😀🙏",1
6792,जब खुद को हुआ कोरोना तो पलटू राम ने कहा। दिल्ली में होगा सब का इलाज। इसे कहते है थूक कर चाटना घुंघरू सेठ 😂,1
6797,"अगर ज़न्नत में हूरें मिलती तो, हाफ़िज़ सईद और मसूद अजहर सबसे पहले ख़ुद को उडा लेते। 😂",1
6799,"कॉलेज का पढ़ा आदमी मात्र प्लेन उड़ा सकता है, जबकि मदरसे का पढ़ा पूरा एयरपोर्ट उड़ा सकता है ? शिक्षा विभाग : पाकिस्तान",1
6800,"हमें विश्व के 57 मुस्लिम देशों से कोई खतरा नहीं है, लेकिन उनको विश्व में सिर्फ एक हिंदू_राष्ट्र 🚩देश बनने से खतरा है ।",1
6802,"अगर भारत का उपराष्ट्रपति_मुस्लिम बनता है तो हमें उससे कोई खतरा नहीं है, लेकिन उन्हें किसी राज्य का मुख्यमंत्री सन्यासी मंजूर नहीं",1
6803,"वो घर घर से अफजल निकालते है , हमें फिर भी उनसे कोई खतरा नहीं है , लेकिन हमारे घर से एक योगी निकला है 💪 तो इस्लाम खतरे।",1
6804,"हमें उनका माशाल्लाह, अल्लाह हू अकबर, नमाज, काबा, रमजान आदि से कोई खतरा नहीं है लेकिन उनको जयश्रीराम के जयकारे से खतरा है।",1
6805,"एक सवाल है ? चार शादी करके 60 बच्चे पैदा करने वालों से हमें कोई खतरा नहीं है, लेकिन उनको RSS के अविवाहित सदस्यों से खतरा।",1
6806,"हमें हरे कपडे, बुर्के, जालीदार टोपी से कोई खतरा नहीं है, लेकिन उन्हे गेरुए रंग के तिलक से खतरा है 😏",1
6807,"एक सवाल ? अगर मस्जिद पवित्र होती है, तो गंदी रोड पर नमाज क्यो ? 🤔 अगर रोड से ही फरियाद पहुँचती है, फिर मस्जिद क्यो? 🤔",1
6808,शांतिदूत के आतंक से दुखी होकर शांतिदूत पर सबसे ज्यादा जुल्म करने वाले देश। चीन: रोजा रमजान दाढ़ी बुरखा सब प्रतिबंधित!।,1
6809,एक पाखण्ड का दूसरा नाम आमिर खान! इतने सारे एपिसोड सत्यमेव जयते का आमिर खान लेकर आया लेकिन कभी भी उसने हिन्दूओ को,1
7108,यह बन्दा कभी डिप्रेशन में नही जा सकता। 😂😆,1
7111,"अगर देश को लूटना हैं, तो BJP को भगाना होगा और खोंग्रेश को लाना होगा! 😂😝",1
7136,जब विरोध करना था तब कर नहीं पाये! मरने के बाद उसका विरोध करके क्या उखाड़ लोगे !,1
7164,अरे भाई उल्टी किताब पकड कर क्या पढ रहे हो? पढ़ेगा इंडिया तभी तो बढ़ेगा इंडिया 😂😝,1
7193,"भारत अब चरखा नही चलाता है, अब सीधे गोली मारता है अस्पताल में भर्ती चीनी सैनिक",1
7267,"रावण, दुर्योधन, कंस में लाख बुराइयां थीं, मगर बीमार होने की झूठी नौटंकी न किये कभी!",1
7274,हिंदू का बच्चा हिंदू है। मुस्लिम का बच्चा मुस्लिम है। तो ये सेक्युलर किसका बच्चा है ?🤔,1
7281,अरविंद केजरीवाल उतना ही दिल्ली वाला है जितना कि सोनिया गांधी भारत वाली है। !,1
7288,वोट बैंक नाराज हो जाएगा इन्हें दलितों की परवाह नहीं है पेंडुलम वाला मीम चाहिए,1
7293,मौलाना साद की जगह अगर कोई हिन्दू धर्मगुरु होता तो कब का पकडकर जैल मे डाल दिया होता,1
7301,अब तो NDTV के ऑफिस में डर का माहौल होगा लगता है।,1
7471,अस्पताल हैं या श्मशान घाट? #MaharastraCovid,1
7520,"☝️ क्या किसी ने कभी सोचा आमिर खान, शाहरुख खान, और सलमान खान की दादा और नाना बनने की उम्र में सिर्फ इनकी ही फिल्में सुपरहिट क्यों जाती हैं । !🤔 #nepotismkilledsushant",1
7523,3 महीने लॉकडाउन रहा प्रकृति_शुद्ध हो गई वैसे ही 1 साल बॉलीवुड फिल्मे देखना बंद करो संस्कृति शुद्ध हो जाएगी। ! #bycottkhangangmovie #BycottBollywood,1
7528,"चाइनीज MI Note 9 फोन की ऑनलाइन सेल थी 30 सेकंड में 1 लाख फोन बिकने की‌ खबर , ओर हम बात करते है चाइनीज सामानों के बॉयकॉ।",1
7530,तुम Tik Tok पर वीडियो बनाते रह गए और वहां हमने अपने 20 जवान खो दिए। पता नहीं भारतीयों के खून में उबाल कब आयेगा? #BoycottChinaProducts,1
7536,"सारी समस्याओं की जड़ C ही है कोरोना, चीन, कॉंग्रेस, चमचे, चूतिये, छक्के और चरणचाटूकर गद्दार । 😂🙄😂",1
7543,ज़िंदा रहने का हर फ़न सीखे हैं मैदान में आते ही ज़िंदा रहना भूल जाते हैं।,1
7546,ये साल क्या चाहता है? मनहूसियत भी शर्मा गई 2020 के आगे,1
7561,"न पड़ोसी का लिहाज़, न विएना कन्वेंशन का।",1
7584,कसम से किंग कोबरा की इतनी बेज्जती कभी नहीं हुई होगी 😅,1
7598,यूपी में बस पर सवार पॉलिटिक्स : सीधा सवाल,1
7608,तुझे घर से बाहर आना है मुझे बस अब घर जाना है मैं मज़दूर हूँ #LabourMigration,1
7625,"थकना, हारना, टूटना मानव को मंज़ूर नहीं है, हमें बचना भी है और आगे बढ़ना भी है पीएम मोदी",1
7637,इतना दोगलापन लाते कहां से हो?,1
7657,सीधे सीधे कांग्रेसी बोलो घुमा फिरा के क्यों बोल रहे हो,1
7660,दिल्ली के सड जी भूल गये हैं कि सड़ी हुई चीजें हमेशा नालों में फेंकी जाती है,1
7666,शेरनी तो अकेली ही होती है झुंड में तो सुअर चलते हैं #AjayPanditaAmarRahe,1
7667,चाइना दस जनपथ में घुस चुका हैं,1
7679,यह फिर आ गया अपनी बेइज्जतीकरवानने के लिए इसीलिए तेरे को पप्पू कहते हैं,1
7683,जो खुद को दिल्ली का मालिक समझ कर बैठा है वह खुद तो कहीं और से आया है,1
7684,और भी बहुत पत्रकारों पर F I R हुई थी वह तो तुमको नहीं दिखी अक्ल के अंधे नाम नयनसुख,1
7688,13 साल तड़पता बिहार नहीं 13 साल तड़पती कांग्रेस और आगे भी कई सालों तक ऐसे ही तड़पती रहेगी,1
7694,मानसिक दिवालियापन का कोई इलाज नहीं है भगवान श्री राम आपका भला करें #100crore25crore,1
7700,सब कुछ पुराना हो गया कांग्रेस में अब कुछ नया नहीं बचा राम नाम की माला जपो,1
7705,हम तो घुटनों पर भी झुक जाएंगे लेकिन वह वंदे मातरम भी नहीं बोलेंगे,1
7713,तो चच्चा आपकी ट्रंप से क्यों जलती है,1
7715,ये कौन सा विज्ञान है प्रभु जिससे खान मायनो वाड्रा सब गाँधी हो जाते है 😑,1
7718,अन्ना भ्रष्टाचार मिटाने निकले थे दिल्ली में सिर से पांव तक डूबा भ्रष्टाचारी छोड़ गए।,1
7780,मोमता हमेशा पोरीबोरतोन (परिवर्तन)कहती है पर पत्रकारों ने चोरीबोरतोन सुन लिया था! 😉,1
7799,"घुँघरू सेठ ने मफलर नहीं पहना इस साल, नोटों की गर्मी से ही काम चल गया।",1
7811,कलावती जी के CM हाउस पहुंचने से 15 मिनट पहले केजरीवाल अपने घर से ही भाग गए। भाग AK भाग,1
7812,केजरीवाल ने जवानी में ही विश्वास को आडवाणी बना दिया। #RajyaSabha,1
7832,"पाकिस्तान वो बेगम है, जिसे अमेरीका से तीन तलाक मिलने पर चाइना से हलाला करवाना पड़ेगा 😹😹",1
7870,5 उपचुनाव के नतीजे: BJP: 3 TMC: 1 Others: 1 महान शिवभक्त की पार्टी घंटा,1
7873,नेताजी पर अब कोई कार्यवाही नही होगी। हमे तो पहले ही पता था कोई डील जरूर हुई होगी 😂,1
7897,ExitPoll देखकर नाखून मत चबाइए क्यूंकि 18 दिसंबर को सिर खुजाने के लिए कुछ तो होना चाहिए। 😄,1
7899,पूरे विधि विधान से कांग्रेस को राहु(ल) लग गया ।,1
8093,ऐसी महानुभाव पब्लिक की वजह से कोरोना को हराना मुश्किल ही नहीं नामुमकिन हो जाएगा 🤦,1
8139,सात समंदर पार करना सुना था। आपने लॉकडाउन में तीन राज्यों की पुलिस पार कर ली! 😄,1
8147,इमारतें तो अंग्रेजों ने भी भारत में बहुत बनवाई थीं। तो इसका मतलब क्या हुआ? #CAA_NPR_Protest #asadowaisi,1
8227,तो अब NDA vs UPA है? NDA vs महागठबंधन है? या NDA vs UPA vs तीसरा मोर्चा है? #IndianPolitics,1
8231,मादरे वतन भारत ज़िंदाबाद! उम्मीद है नारे से धर्म निकल गया। 😊,1
8368,बिग ब्रेकिंग। कश्मीर में सुरक्षाबलों ने 8 आतंकियों को मार गिराया है 72 हूर दे दी गई 💪🏻😂 #Terrorism,1
8374,भारत हम पर हमला कर सकता है : इमरान खान मियाँ बीबी के झगड़े का अंत घर के छोटे बच्चे की पिटाई से ही होता है 🤣 पाकिस्तान को भी यही खौफ है,1
8382,"मुसलमान को कभी भी आरक्षण, रोजगार और विकास की मांग करते हुए नहीं देखा होगा क्योंकि उन्हें विकास , रोजगार और आरक्षण से ज्यादा।",1
8385,मोहब्बत अंधी होती है ये तो सुना था पर। इतनी लंबी होती है ये आज ही देखा 😃😂😆😀😅😂,1
8389,"रहने दे मुझे #अँधेरे में ए ग़ालिब, 😒 उजालो में मुझे 🤗अपनों के #असली चेहरे नज़र 👀आ जाते है। ! 😓 #GoodMorningTwitte।",1
8393,राहुल गाँधी की कुंडली देखचंद्रास्वामीने कहा था बालक Pappu पार्टी के लिए राहु काल बन अवतरित हुआ है 🙀 कांग्रेस के लिए घात।,1
8413,"हेयर ड्रेसर तो आपको राजीव गांधी इंदिरा गांधी का लुक दे सकता है, लेकिन। ? भेजे का क्या करेंगे, भेजा कौन देगा",1
8419,"हिन्दुत्व के लिए। लड़ नहीं सकते तो लिखो। , और अगर लिख नहीं सकते तो कम से कम विरोध तो मत करो, फिर भी खुजली होती है तो डुबमरो जाहिलो! । ।",1
8422,ये शुक्र है जंगल में आरक्षण नहीं बहोत नहीं तो जंगल का राजा शेर नहीं गधा होता आरक्षण खत्म करो 70 साल हो गये यार #आरक्षण_भीख_है,1
8467,पाकिस्तान के पप्पू को भारत के पप्पू से बहुत उम्मीदें हैं! 😂,1
8472,मंदिरों में रेप होते हैं और बाक़ी जगह के लिए ये आँख नाक कान बंद कर लेते हैं!,1
8474,"बांग्लादेश के जन्म के 48 साल बाद पाकिस्तान फिर पेट से है, और अबकी बार बलूचिस्तान नामक बच्चे की किलकारी गुंजने वाली है!",1
8476,हमें परमाणु बम की धमकी मत दो पाकिस्तानियो। हम तूम्हारे यहां टमाटर भी फेक दें तो पूरे मुल्क में भगदड़ मच जाएगी। 😂 भिखारी 😛,1
8477,पाकिस्तान के लिए दो लाइन अर्ज़ हैं। गीले चावल में शक्कर क्या गिरी तुम भिखारी खीर समझ बैठे चंद ग़द्दारों ने पाकिस्तान ज़िन्दाबाद क्या बोला तुम कश्मीर को अपने बाप की जागीर समझ बैठे,1
8479,"धारा 370 हटाने के विरोध में कांग्रेस इतनी दलीलें क्यों दें रही है, संविधानिक त्रासदी ये लोग बता रहे जिन्होंने संविधान की ऐसी तैसी करने में कोई कसर नहीं छोड़ी! आपातकाल लगाया, संविधान में मनमाने संशोधन करके धर्म के आधार पर विभाजित हुए देश को सेकुलर देश बनाया।",1
8499,भाजपा के स्टार प्रचारक राहुल गांधी को पद से न हटाने के लिए #CongressWorkingCommittee का हार्दिक आभार,1
8501,राहुल गांधी ने अपने वरिष्ट नेताओ पर नाराजगी जताते हुए कहा कि उन्होंने पार्टी से ऊपर अपने परिवार को रखा और अपने बेटों को टिकट दिलाये। भाई ये बात अपनी माता जी को भी समझा दो जिसने अपने बेटे को दो जगह से लड़ाया था और एक अमेठी वो हार भी गया। फिर किसी को समझाने की जरूरत नही पड़ेगी। 😉,1
8503,"इस्तीफा राहुल गांधी ने नही अध्यक्ष ने दिया था, पर उसे नामंजूर राहुल गांधी ने कर दिया। 😊",1
8506,"बिहार के हर घर में बिजली के प्रकाश का ऐसा फैला उजियारा, बिहार ने लालटेन को पूरी तरह से नाकारा , अब लालटेन पटना म्यूजियम में ही दिखेगा बेचारा।",1
8509,राहुल ममता को नकारा बताते हैं। ममता राहुल को बच्चा बताती हैं। अखिलेश माया को टिकट बेचने वाली कहते आए हैं। माया उन लोगों को गुंडा बताती आयी हैं। राहुल तेजस्वी के पिता लालू को चुनाव लड़ने की आज़ादी देने वाला अध्यादेश खुलेआम फाड़कर फेंकते आए हैं। नायडू केसीआर को गरियाते आए हैं।,1
8512,"बंगाली अस्मिता का मुद्दा ममता बनर्जी को सूट नहीं करता। एक दशक में उन्होंने वन्देमातरम्, माँ दुर्गा और नारी चेतना का बिलकुल ध्यान नहीं दिया और न ही कभी औद्योगिक उन्नति के केंद्र बंगाल को फिर से वापस विकास व उन्नती रोज़गार के मार्ग पर लाने का काम किया।",1
8513,नोटबंदी से थके नहीं क्या? अबकी बार फिर से नरेंद्र मोदी सरकार,1
8516,चुनाव प्रचार का आगाज चौकीदार चोर है चुनाव प्रचार का अंत मेरा बाप चोर नही है,1
8517,#प्रधानमंत्री योगी आदित्यनाथ जी महाराज का इस्तीफा माँगती हुई क्रांग्रेसी #राजमाता। ! #2034,1
8519,1बाबरी म$जिद टूटने पर वो BJP को वोट नही देते उधर कश्मीर में 50 हजार मंदिर तोड़ दिए फिर भी मुर्ख हिंदु कांग्रेस की गुलामी कर रहे हैं🚩,1
