ID,Sentence,RajivJi
5316,जब मार्केट में 25% लेकर हाथों हाथ काले धन को सफ़ेद करने वाले बैठे हों तो कोई मोदीजी को 50% देकर भी 4 साल वेट क्यों करे! जागो ग्राहक जागो !,1
5318,सुबह तक का काला धन शाम तक 50% घर आ जाय तो वह काला धन नही है।,1
5319,मैं कहता हूँ जब 90%देशवासी #pm के साथ थे तो मात्र 10% काले धन वालों के लिये ये 50 50 की स्कीम क्यों जेल क्यों नहीँ,1
5321,"#खूनीDemonetisation जनता को लाइन मे लगा कर, पैसे पैसे को मोहताज कर साहेब चुनाव प्रचार मे लगे है #13दिन से देश ठप है मोदी मै मै का जाप कर रहे",1
5322,#खूनीDemonetisation की वजह से लोगों के मरने का आंकड़ा तेजी से बढ़ता जा रहा है। और मोदी कल आगरा में कह रहे थे कि देश का स्वर्ण काल आ रहा है।,1
5323,Congress VP Rahul Gandhi तो लगातार बैंक और ATM जा रहे हैं लेकिन सोचने वाली बात ये है की PM मोदी का ख़र्चा कौन चला रहा है,1
5324,बैंक की लाईन में इतिहास की सबसे डरावनी धमकी : मुझे नए नोट लेने दो वर्ना मैं फिर से मोदी को वोट दुंगा #खूनीDemonetisation,1
5327,मीडिया ने यह तो बताया कि मोदी की मां हीराबेन भी नोट बदलने गईं अगर यह भी बता देते कि जिस लाईन मे वे लगी या लगी भी अथवा नही वह कितनी लंबी थी ?,1
5333,राहुल गांधी माँ मुझे 6 बजे जगा देना। सोनिया गांधी क्या हुआ बेटा? राहुल गांधी माँ मोदी जी ने सोने पर टैक्स लगा दिया है ना।,1
5334,यार सारा देश मोदी के कदम की तारिफ कर रहा है तुम टोल टैक्स व राहुल गांधी पैसे बदलने वाली लाइन मे उलझे हुए है,1
5337,सब यही कह रहे है पिछले 36 घण्टे में तीन बार राहुल गांधी थाने जा चुके है लेकिन ये कोई नही कह रहा पुलिस अब तीसरी बार उसे बाहर पटक के गयी है।,1
5340,"खुदा न खास्ता हैकर ने रागा का बैंक अकाउंट हैक किया होता तो कांग्रेस के लिए भी सर्जिकल स्ट्राइक जैसी स्थिति हो जाती, कबूल फिर भी नहीं करते।",1
5343,"लगता है राहुल को FB पर एक पॉर्न वेबसाइट का लिंक मिला होगा तो उसने उसपर क्लिक कर दिया। हो गया अकाउंट हैक, फिर यही गलती कांग्रेस ने कर दी।",1
5344,"अगर मोदीजी ढाई लाख वाली शर्त ना लगाते तो इस बार मैं पक्का शादी करने वाला था, शादी के लिए इतने सारे रुपए चाहिए भैया राहुल गांधी",1
5346,दिली तमन्ना है राहुल गांधी की शादी में आज मेरे यार की शादी है। गाने पे नागिन डांस करने का। पर वे शादी करके न दे रहे। केजरीवाल जी समझाएं।,1
5347,राहुल गांधी जी को शादी मुबारक। बधाई हो कांग्रेसियों को आखिकार भाभीजी मिल ही गयी।,1
5349,ट्रंप ने दी पाक को 90 करोड़ डॉलर की आर्थिक मदद मतलब ट्रंप के लिए हवन भक्तों ने किया लेकिन ट्रंप को भी बिरयानी पाकिस्तान की ही पसंद आई,1
5350,"बेइज़्ज़ती की इंतेहा। इधर पाक प्रशासन ने ट्रंप के हवाले से शरीफ की तारीफ की खबरें चलवाईं। उधर ट्रंप कह रहे। अबे, मैंने ऐसा तो नहीं कहा था",1
5351,मोदी भक्त हवन करेंगे हवन करेंगे हवन करेंगे ट्रंप पाकिस्तान एक बेहतरीन देश है यहाँ के लोग माॅस्ट एंटलीजेंट हैं भविष्य में मै पाक जाना चाहूंगा,1
5353,भक्तगण पानी से निकली मछली की तरह तड़प रहे होंगे जब सुने होंगे की ट्रंप ने कहा पाकिस्तान एक शानदार देश है और यहा के लोग सबसे समझदार लोग है।,1
5354,#भारत_बंद सुनकर आलिया भट्ट यह सोच कर सदमे में है कि पूरे भारत को बंद करने केलिए इतना बड़ा ताला आएगा कहाँ से,1
5357,सुबह 9 बजे भारत बंद। दोपहर 12 बजे आक्रोश दिवस। शाम 6 बजे कुंठा दिवस।,1
5358,#भारत_बंद पुरी तरह विफल होने के बाद झूलेलाल फ़र्ज़ीवाल का मुँह काला कर गंधें पर बिठाने कि तैयारी करते सुसुदिया जी !,1
5360,जिस देश में करोड़ों रुपये का घोटाला करने वाले खुले में शौच कर रहे उसी तरह सलमान खान भी जमानत लेने के हकदार हैं,1
5361,"सलमान खान अब खुले में शौच करने के खिलाफ प्रचार करेंगे सही है भिया, डर से लोग खुले में शौच जाना ही छोड़ देंगे, गुस्से में भाई कहीं कुचल ही न दे",1
5363,"जरूर सलमान भाई इस #हिरण को पाकिस्तान छोडऩे गए होंगे, उन्हें हिरणों से बड़ा लगाव हैं",1
5364,"रिपोर्टर: केजरीवाल जी, सलमान खान केस से बरी हो गए हैं, इस बारे में आपका क्या कहना है केजरीवाल: मैंने तो पहले ही कहा था, हिरण को मोदी ने मारा है",1
5365,हमारे देश में कोई न्यायपालिका को कंट्रोल नहीं कर सकता है। सलमान खान की गाड़ी भुत चला रहा था और हिरण ने खुद ही खुद को गोली मार ली थी।,1
5366,अगर मोदी जी कुछ दिन के लिए सलमान को भारतीय रेल मे ड्राइवर बना दे तो पटरी मे दो नम्बर करने वालों की संख्या मे भारी गिरावट आ सकती है।,1
5367,कोर्ट में जज हैं या निर्मल बाबा? जिस कोर्ट को चौदह साल में यह पता नहीं चला कि गाड़ी सलमान चला रहा था या उसका ड्राइवर! उसने दंगे होना बताया।,1
5368,जिस कोर्ट को ये नहीं पता चल पाया कि गाडी सलमान चला रहा था या ड्राइवर उस कोर्ट को पता चल जता है कि नोट बंदी के कारण देश में दंगे हो सकते हैं,1
5369,"जो अदालत14 साल में ये नही बता सके की गाड़ी सलमान चला रहा था या ड्राइवर, उसी अदालत ने 14 दिन में भविष्यवाणी कर दी नोटबंदी से दंगे भड़केंगे।",1
5370,"खबर मिली है कि सलमान शादी के लिए तैयार हो गए हैं । क्योंकि शादी का कार्ड दिखा कर 2, 50, 000 लाख रुपये बेंक से निकाल सकते हैं।",1
5371,ये लड़कियां चाहे कितना भी सलमान खान विराट कोहली पे मरती हो। अंत में इनकी शादी। किसी जेठालाल से ही होनी है। !,1
5372,"Media on Bharat Bandh: ZeeNews भारत बंद हुआ विफल AajTak भारत बंद को मिला जुला समर्थन Ndtv बंद पूरी तरह सफल, चीन से लेकर युगांडा तक दिखा असर 😂",1
5373,अपने पास तो काले धन में केवल दो भैस और एक पाडो हे वो भी मोदी जी कहेंगे तो बैंक में बाँध कर आ जाऊंगा मुझे भारत बंद का समर्थन नही करना हैं,1
5374,भारत बन्द का समर्थन न मिलने पर आज ने मूली के पराठे खाकर अपने समर्थकों की नाक बंद करवाई और भारत बन्द को सफल घोषित किया।,1
5375,विपक्ष आज आक्रोश दिवस मना रहा है और ये आक्रोश उस जनता के प्रति है जिसके समर्थन न देने पर भारत बंद को आक्रोश दिवस बनाना पड़ा!,1
5376,आम आदमी पार्टी की नींव में कुछ गड़बड़ है। #AAP,1
5377,"इस बार नेता नहीं, बल्कि पार्टी की नींव माने जाने वाले वॉलंटियर ही आप को अलविदा कहेंगे। #AAPNot4Punjab",1
5379,"#RamMandir4Hindus बीजेपी के लिए वोट जुगाड़ करने का एक माध्यम है, जो अक्सर बीजेपी को यूपी चुनाव के वक़्त याद आता है। बनो बनो और बनते रहो",1
5382,Dettol के ऐड में पोंछा लगने के बाद जो 2 कीटाणु रह जाते हैं वो राहुल गांधी और अरविंद केजरीवाल हैं !,1
5383,भारत के लोग दो नाम हमेशा याद रखेंगे ? 1 झाँसी की रानी लक्ष्मीबाई 2 झांसे का राजा अरविंद केजरीवाल,1
5389,"छोटे गाँधी जी उच्चतम गुणवत्ता वाला गांजा फूंकते हुए कुछ सच्चाई लिख बैठे, और कांग्रेस अब इसको अकाउंट हैकिंग का नाम दे रही है",1
5399,"या तो रामदेव की कोई जड़ी बूटी उन पर रीएक्शन कर गई है या उन्हें बंगाल सरकार से पतंजलि के लिए जमीन चाहिए, तभी उन्हें ममता में PM नज़र आ रहा है।",1
5400,सोना चाँदी च्यवनप्राश में उतना ही सोना है जितनी बाबा रामदेव में देशभक्ति।,1
5402,"अल्लाह को मानने वाले, हर मन में अल्लाह बसता है, बम बनाकर, आतंकवाद फैलाने की क्या जरूरत है।",1
5403,"कालाधन व आतंकवाद खत्म करने के नाम पर, देशभक्ति का सबूत देने हम कतारो मे जुटे है।",1
5406,"जिन्हें चींटी और हाथी के दंत कथा पर तरस आता हो या फिर बकवास अनुभव किया है, वह कृपया एक रात मच्छर के इलाका में चैन की नींद लेकर सो जाएं।",1
5412,इनको ये समझ नही की जिस दिन हम अपनी पे आएंगे ये बाप बाप चिलायेंगे। हाँ अफगानिस्तान से भी आगे तक हमारे बाप का रहा है फारुख साब,1
5414,"जब पाकिस्तान पाकों का है, अफगानिस्तान अफगानों का है, तुर्की तुर्कों का है, अरब अरबों का है तो हिंदुस्तान सेकुलुरों का कैसे?",1
5417,बुढ्ढे को जवान दिखने के लिए 6 घंटे का मेकअप कम है इसको 6 साल तक मेकअप करना चाहिए। तब तक देश में असहिष्णुता भी ख़त्म हो जायेगी,1
5418,"ट्रम्प ने हिलेरी पे यू टर्न ले लिया है, अमेरिका वालों को धीरे धीरे पता चलेगा, उन्होंने अपना मोदी नहीं केजरीवाल चुना है।",1
5419,डोनाल्ड ट्रम्प ने कहा था वो हिलेरी को जेल भेजेंगे अब उन्होंने यू टर्न ले लिया केजरीवाल और शीला दीक्षित स्टोरी का अब हॉलीवुड में रीमेक बना,1
5421,थोड़ी देर हो गयी वर्ना हिलेरी क्लिंटन की जगह मोदी अपनी माता जी अमेरिका में राष्ट्रपति के इलेक्शन में खड़ी करवा देते।,1
5424,"आज संविधान दिवस है । आज ही के दिन 4 वर्ष पूर्व, आम आदमी पार्टी के नाम पर मेरे काला धन का जन्म हुआ #DeMonetisation करके मोदी ने सब तबाह कर दिया",1
5429,"दिक्कत सिर्फ चिटफण्ड घोटाले में कमाए रोकड़ो के एक झटके में रद्दी हो जाने की है, जो दीदी कोलकाता से दिल्ली दौड़ रही है।",1
5431,बेगम मोमता को भारतीय सेना से डरा देख बंगलादेश की शेख हसीना की हँसी ना रुक रही,1
5432,"वो लोग कर रहे है जिनका चाचा नवाज़ शरीफ, बुआ शेख हसीना है जो खाए देश का और काम करे दुश्मनो के लिए, उनको ही PM से तकलीफ है",1
5436,एक लडकी मेट्रो में बडी देर से मोदी के गुण गा रही थी मैने कह दिया भगवान करे आपको मोदी जैसा पति मिले। उसके बाद अब शांत है।,1
5437,"लखनऊ में जल्द ही मेट्रो दौड़ेगी, और इस मेट्रो में गति की ओर का पहला डब्बा गुटखा खाने वालों के लिए आरक्षित रहेगा।",1
5439,"गूगल, माइक्रोसॉफ्ट, रिलायंस , फेसबुक, एप्पल सबके मालिक लड़के हैं आखिर लडकियाँ इतने मार्क्स लेकर करती क्या हैं ? बैंगन का भर्ता बनाना,",1
5443,मोमोता दीदी ने कहा। नोइ करेगा सड़क पोर बोन्द बाबा ! ऑन लाइन बोन्द बुलाएगा अब। वोडाफोन एयरटेल वालों का टॉवर पकड़ लेगा हम,1
5444,अगर किसी दिल्ली वाले का पारा हाई करना हो तो बस उसके आगे जोर से पांच साल केजरीवाल बोल दो,1
5445,अरविन्द केजरीवाल के भोपाल आने की खबर सुनके व्यापम के खलनायक जी दूसरे ग्रह पे जा पहुंचे,1
5446,अंबानी ने जियो लाकर फ्री डाटा दिया ही इसलिए था ताकि ज़्यादा से ज़्यादा लोग मोदी को ऑनलाइन वोट देकर Time of year बना सकें केजरीवाल,1
5448,सेना ने रूटीन अभ्यास के बंगाल पुलिस से सतत संपर्क के दस्तावेज जारी किये। क्या दीदी माफ़ी मांगेंगी। नहीं। क्योकिं मोमता अब केजरीवाल हो गई है!,1
5449,"इतिहास गवाह है, केजरीवाल ने जिस जिस से इस मुद्रा में बात किया है, उनका क्या हुआ, अब दीदी की बारी है",1
5450,केजरीवाल और ममता बनर्जी में कडा मुकाबला चल रहा है केजरीवाल ने तो दिल्ली पुलिस को ही गालियाँ दी दीदी ने तो फौज कि मां बहन एक कर दी। !,1
5452,"टीआरपी का खेल देखो। अस्पताल कहता है वो ज़िंदा हैं, मीडिया कहता है नही। प्रतिस्पर्धा है, कौन खबर पहले देगा। पर मौत को तो बक्श दो।",1
5455,"शहंशाही नहीं, मुझे फकीरी अदा कर मौला। मोदी जी तीन और फ़क़ीर टाटा, अंबानी और कामथ के साथ रूहानी चर्चा करते हुए।",1
5462,#JIO का सच नीता अंबानी ने मन्नत मांगी थी कि अनंत अम्बानी अपना वजन कम कर लेगा तो गरीबों में 3 महीने Net or call का भंडारा करवाऊँगी,1
5465,नीता अंबानी ने मन्नत मांगी थी कि अगर अनंत अम्बानी अपना वजन कम कर लेगा तो गरीबों में 6 महीने Net or call का भंडारा करवाऊँगी,1
5466,"यदि बैंक की लाइन मे लगने से हुए मृत्यु के लिए PMजिम्मेदार है, तो भारत पाक बटवारे मे 6 लाख की मौत का जिम्मेदार कौन? नेहरू गाँधी?",1
5473,"क्या आदमी है पढ़ा लिखा गंवार, मोबाइल से बेसिरपैर ट्वीट कर सकता है, पर उसी मोबाइल से बैंकिंग करना नहीं जानता",1
5476,"लाला, तुम किस चक्की का खाते हो? इस डेढ़ छँटाक के राशन में भी तोंद बढ़ाए जाते हो।",1
5477,"आराम ज़िन्दगी की कुंजी, इससे न तपेदिक होती है। आराम सुधा की एक बूंद, तन का दुबलापन खोती है।",1
5478,"आराम शब्द में राम छिपा जो भव बंधन को खोता है। आराम शब्द का ज्ञाता तो विरला ही योगी होता है। इसलिए तुम्हें समझाता हूँ, मेरे अनुभव से काम करो। ये जीवन, यौवन क्षणभंगुर, आराम करो, आराम करो।",1
5479,यदि करना ही कुछ पड़ जाए तो अधिक न तुम उत्पात करो। अपने घर में बैठे बैठे बस लंबी लंबी बात करो।,1
5480,"करने धरने में क्या रक्खा जो रक्खा बात बनाने में। जो ओठ हिलाने में रस है, वह कभी न हाथ हिलाने में।",1
5481,तुम मुझसे पूछो बतलाऊँ है मज़ा मूर्ख कहलाने में। जीवन जागृति में क्या रक्खा जो रक्खा है सो जाने में।,1
5482,"मैं यही सोचकर पास अक्ल के, कम ही जाया करता हूँ। जो बुद्धिमान जन होते हैं, उनसे कतराया करता हूँ।",1
5483,"मेरी सेहत का राज यही कि, दीए जलने के पहले ही घर में आ जाया करता हूँ। जो मिलता है, खा लेता हूँ, चुपके सो जाया करता हूँ।",1
5484,"मेरी गीता में लिखा हुआ सच्चे योगी जो होते हैं, वे कम से कम बारह घंटे तो बेफ़िक्री से सोते हैं।",1
5485,"जब सुख की नींद कढ़ा तकिया, मेरे सर के नीचे आता है, तो सच कहता हूँ मुझको तो संसार का मोह मिट जाता है।",1
