ID,Sentence,RajivJi
148,हमारे देश की पत्रकारिता के क़लम मैं स्याही की जगह।। पैसा दारू और ऐयाशी है ।। अब बोलो क्या ये भजन गायेंगे,
154,अगर यही खुलासा किसी भारतीय क्रिकेटर ने किया होता तो मीडिया और सिक्युलर उसे ही झूठा ठहरा चुके होते,
178,जब आम जनता मारे तो नक्सली भटके हुए नव जवान है और जब कांग्रेसी मरे तो लोकतंत्र पर हमला,
193,माँ के बेटे जो सीमा पर लिखते हैं अपने शोणित से समझोतों वाली स्याही से दिल्ली वाले धो देते हैं,
201,पति: डार्लिंग आज बरसात हो रही है मौसम बहुत अच्छा है कोई ऐसी रोमांटिक बात कहो की मेरे पैर जमीन पर न रहे। पत्नी: डार्लिंग फांसी लगा लो,
214,सचिन जी को कांग्रेसी बनने पर तहे दिल से ढेर सारी गालियाँ,
215,दिग्विजय सिंह जैसे ही गांधी की प्रतिमा पर फूल चढ़ाने झुके लाठी से धकेलते हुए आवाज आई दूर हटो बेटा वरना अहिंसा की कस्म टूट जाएगी rerun,
218,चुगली करना हमारा राष्ट्रीय छंद है.,
236,अरे भैया आम आदमी को इस बजट में कुछ मिला है क्या ? हाँ दादाजी मिल है न. क्या ? अंडा,
247,हम तो इस देश की अर्थ व्यवस्था का अर्थ समझना चाह रहे थे मनमोहन. तुमने तो अर्थ व्यस्था की अर्थी ही निकाल दी.,
263,काश्मीर में जनगणना का कार्य इसी बहाने पूरा हो जाएगा #KashmirFloods,
1012,केजरी ने कहा की गुजरात में कुछ भी विकास नहीं हुआ है जबकि वो गुजरात गए पैसेंजर ट्रैन से और लौटे एयरोप्लेन से 1 ही दिन में इतना विकास नमो नमो,
1091,मोदी ने शिक्षक दिवस के दिन एक ही समय में पुरे देश के बच्चो से बात की जबकि मनमोहन सिंह एक ही बच्चे से 10 साल बात करते रहे,
5731,"बाप की जमी जमाई दुकान बर्बाद करके जो बेटा दूसरे की दुकान पर नौकरी करने लगे, उसे उद्धव ठाकरे कहते हैं। 😂",
5734,कोई प्रियंका गांधी को जौनपुर का पता बतादो यार. CAA का विरोध करने वाले दंगाइयों के घर-घर जाकर आंसू पोछने वाली प्रियंका,
5785,"तू बिमारी है किसी और की, तुझे झेलता कोई और है ! COVID-19 😡😂",
5786,"तेरी गलियों में ना रखेंगे आज के बाद कदम , कल ही चार पॉजिटिव निकले हैं.! 😷😬😂",
5816,मोदी जी कमजोर प्रधानमंत्री है. नेहरू जी तो मुह से ही बोफोर्स के गोले फेक देते थे.!! 😂,
5837,अब सच में जितने चोर थे वालेड पेपर लूटने वाले वो ईवीएम की सुरक्षा कर रहे हैं। यह विकास नहीं तो क्या है।,
5944,यही है जो चंदा बाबू से बुआ बबुआ से दीदी से सबसे मिले थे। मानसिक संतुलन बिगड़ता हुआ । भगवान इनको शक्ति दे 🤣,
6096,"एक तरफ पाकिस्तान कटोरा लेकर कई देशों से भीख मांग रहा है तो दूसरी ओर कर्ज में डूबा पाकिस्तान भारत की मदद की बात कर रहा है। कटोरा खान की ये बातें सुनकर मेरी मां की कही एक बात याद आ गई। घर में नहीं दाने, अम्मा चली भुनाने।",
6280,चाइना के फोन से ही चाइनीज सामान का बहिष्कार कर रहे हैं हम भारतीय. कितना महान कार्य कर रहे हैं. 😠,
6285,चीन के पास सैनिकों की संख्या ज्यादा है. ये परेशानी की बात नहीं है. भारत के पास गद्दारों की संख्या ज्यादा है. ये परेशानी की बात है.,
6307,बाॅलीवुड में 34 साल के युवा को आत्महत्या करनी पड़ जाती है. और 54 साल का बुढ्ढा हीरो बना रहता है. 😠,
6318,माँ को मुखाग्नि दिये बिना बेटा चला गया भारत माँ की रक्षा के लिए. और यहाँ लोगों को टिकटाॅक से फुर्सत नहीं है. 😠,
6320,मुरारी बापू जैसे लोगो ने ही हिन्दू धर्म का बेडागर्क कर रखा है. कभी न सुना होगा कि किसी मौलवी ने राम भजन गाया है.,
6340,स्वच्छ भारत मिशन में सबसे ज्यादा साथ तो मोदी जी का राहुल गांधी ने ही दिया है. बंदे ने अपनी सारी पार्टी ही साफ करा दी अब और बच्चे की जान लोगे क्या. जन्मदिन की हार्दिक शुभकामनाएँ आउल बाबा 😂,
6347,#who का कहना है कि #कोरोनावायरस के साथ ही जीना सीखना होगा. ऐसा करने में बाकी देशों को तकलीफ हो सकती है😢😢 लेकिन हिंदुस्तानियों को नहीं होगी 🤔 क्योंकि हिंदुस्तानी तो कई साल से कांग्रेस के साथ जी ही रहे हैं 😜😂,
6348,"#कोरोना ख़त्म होने के बाद एक और मुसीबत आएगी उसका नाम है ""भरोना"" 🤔 घर का किराय, बिजली का बिल, स्कूल की फीस, EMI की किस्त राशन का बिल "" ""भरोना"" ""भरोना"" 😜🤣",
6349,60 साल तक लोगों की आवाज दबाने वाले आज स्पीक अप इंडिया की बातें कर रहे हैं,
6350,8 जून को भगवान का द्वार खुलने वाले हैं 🙏 उस दिन मंदिर मे इतनी धक्का मुक्की मत करना की भगवान face face मिलने ऊपर ही बुला ले 😜😁,
6353,अखिलेश यादव को अरबपति बनाकर प्रदेश के बाकी यादव भाई रोजगार के लिए इधर-उधर भटक रहे हैं,
6354,"अगर भारत को विकसित देश बनाना है तो सिर्फ चीनी सामानों का बहिष्कार नहीं कुछ ""इटली"" के सामानों का भी बहिष्कार करना पड़ेगा 😁",
6356,अब मजदूरों की भी टोटी चुराएगा क्या 😜,
6357,"अर्ज किया हैं, चाय किसी भी उम्र में बेची जा सकती है ग़ालिब . पर ठुमके लगाने की एक उम्र होती है. सही सोच रहे हैं आप इस लाइन का संबंध देश के 2 बड़े नेताओं से ही है 😜😂",
6358,आ गए चमचे अपने मालिक का बचाव करने 😜😂,
6360,"आज एक कार पर स्टीकर देखा "" भूतपूर्व करोना मरीज़ "" जब उसके ड्राइवर से पूछा ऐसा स्टीकर क्यू 🤔 तो उसने कहा कि इस के कारण ना तो कोई पुलिस वाला कागज चैक करता है और ना ही गाड़ी खड़ी करवाता है । 😄",
6362,आधे से ज्यादा राज्यों के सीएम का तो यह हाल है lockdown लगा दिया है और आराम से सो गए हैं क्योंकि उन्हें पता ही नहीं है करना क्या है,
6364,आम जनता को कर दिया घर में बंद और नेता कर रहे हैं मजे MP अजब है सबसे गजब है,
6368,इनकी मीटिंग खत्म होने के बाद ही कॉन्ग्रेस तय करेगी lockdown बढ़ाने की बुराई करनी है या lockdown खत्म करने की .,
6369,इस देश में सबको अपनी-अपनी पड़ी है किसी को समय नहीं कुर्बानी को याद करने की,
6372,इसे कहते हैं समझदार मुख्यमंत्री जब करोना से लड़ने की औकात नहीं तो बस लोग डाउन बढ़ा दो,
6373,इसे पागल खाने वाले भी नहीं बर्दाश्त कर सकते #raga,
6375,ऐसा अगर दिल्ली में होता तो केजरू दीन पेंटिंग में अपनी फोटो जरूर लगवाता ताकि लोगों को उस पर मूतने का मौका मिले 😜,
6379,कभी-कभी लगता है महाराष्ट्र का c.m. उद्धव ठाकरे नहीं बल्कि सोनू सूद है,
6381,कांग्रेस का एक ही मकसद है देश को लूटना जो अब कभी पूरा नहीं हो सकता,
6383,कांग्रेस राज में पुरुषों से भेदभाव 🤔 दादी के नाम पर सैकड़ों योजनाएं पर दादा के नाम पर एक पंचर दुकान तक नहीं 😜😂,
6384,कांग्रेस सिर्फ फैसले में टांग अड़ाती है और कुछ नहीं,
6389,केजरीवाल की कोरोना रिपोर्ट का सच 🤔 केजरीवाल में कोरोना के नहीं कोरोना में केजरीवाल के लक्षण पाए गए 😜😂,
6391,केजरीवाल के पास भी कोरोना आया तो था पर पैर छूकर बोला मालिक हमसे बड़ी महामारी तो आप है 😡 हमारी क्या औकात जो हम आपको संक्रमित कर सके 😢 यह कहकर कोरोना डरकर भाग गया और केजरीवाल की reponegetive आई 😜😂,
6392,"केजरीवाल ने दिल्ली के लोगो से सुझाव मांगे जनता ने बहुत से सुझाव दिए 👍 लेकिन क्या आप जानते है 🤔 जनता ने सबसे ज्यादा क्या सुझाव दिया. वो आपको कोई नही बताएगा चलो हम बता देते हैं "" CM से इस्तीफ़ा दो ""😜 😂",
6394,कोरोना के रहते हुए स्कूल खुल भी जाए तो भी मैं अपने बेटे को स्कूल नहीं भेजूंगा अनपढ़ रह जाएगा तो क्या हुआ सांसद या विधायक तो बन ही सकता है 😜🤣,
6397,कौन से स्कूल मास्टर का बेटा है यह बात न्यूज़ चैनल वाले बताएंगे या कांग्रेस पार्टी,
6401,गरीबों को भोजन मिले ना मिले बेवड़ा को दारु मिलना जरूरी है इन्हीं बेवडो पर देश की अर्थव्यवस्था जो टिकी है 😜😂,
6406,चिंता यह नहीं है कि ताहिर की जमात वाले चुप है चिंता यह है कि अंकित की जमात वाले चुप क्यों हैं,
6409,"अच्छा, हमसे अपेक्षा की जाती है कि चीनी सामानों का बहिष्कार करे और टीवी चैनल पर सेलिब्रिटी इन का प्रचार करना ठीक है",
6412,जिंदा है या मर गया यह भी बता दो ताकि कपिल सिब्बल इसके लिए केस लड़ने की तैयारी करें 😜,
6413,जिन प्रदेशों के मुख्यमंत्री के पास कोरोना से लड़ने का कोई रोडमैप नहीं है उन्हें एक ही चीज समझ में आती है बस लॉक डाउन बढ़ा दो और छुट्टी पालो,
6419,तुम लोग पैदाइशी दोगले हो या कोई कोर्स किया है,
6423,दिल्ली के कौन से मोहल्ला क्लीनिक में केजरीवाल का इलाज होगा 🤔 या फिर हरियाणा भेजा जाएगा 😜,
6424,दिल्ली में लगे जाम को देखकर लगता है सारे काम करने वाले दिल्ली में ही हैं बाकी हम तो कामचोर है,
6428,देश को एक खानदान ने लूटा 😡भाजपा में कहां दम 💪 था चमचो ने अपना नेता भी उसे चुना जिसमें दिमाग कम था 😜😁,
6429,धर्मनिरपेक्षता के नाम पर इस देश में सिर्फ और सिर्फ नौटंकी चल रही है सारी सुविधाएं एक विशेष धर्म के लोगों को दी गई है,
6431,नौकरी रहेगी या नहीं यह पता नहीं और बात सैलरी की हो रही है,
6432,पप्पू का नया हेयर स्टाइल उसकी मंदबुद्धि वाली शक्ल पर खूब जच रहा है 😜,
6434,परेशानी यह नहीं कि चीन के पास सैनिकों की संख्या ज्यादा है बल्कि परेशानी इस बात की है कि भारत के पास गद्दारों की संख्या ज्यादा है,
6436,प्रियंका की नाक इंदिरा गांधी से मिले ना मिले बुद्धि जरूर पप्पू से मिलती है,
6438,प्लान B छोड़ो जैसे कांग्रेस को खत्म किया है वैसे ही कोरोना को खत्म करो,
6444,मानसून मुंबई पहुंचने के बाद बरसेगा या 14 दिन के लिए क्वॉरेंटाइन होगा 🤔 😂,
6445,मुझे खुद का ट्वीट खुद ही लाइक करने में शर्म आती है और कुछ लोगों ने खुद को ही भारत रत्न दे दिया था 😜,
6446,मैक्स हॉस्पिटल क्यों मोहल्ला क्लीनिक क्यों नहीं #Kejriwal_Corona,
6448,यह कैसी महानता 🤔 जो अकबर भारत की इतिहास की किताबों में तो महान है पर बाकी के 57 इस्लामिक देशों में उसके नाम का शौचालय तक नहीं 😜😂,
6449,यह तो निर्मल बाबा को पूछना पड़ेगा कौन सी चटनी खाने से फायदा होगा 😜😂 #Corona_Vaccine,
6450,"चीनी राष्ट्रपति‍ का बड़ा बयान, सेना को युद्ध के ल‍िए तैयार रहने को कहा. यह तो वही बात हुई दस्त लगे हुए हैं और शंख बजाने की तैयारी 😂",
6452,यह बात उन्हें समझ नहीं आएगी जिन्हें एक ही परिवार की गुलामी करने की आदत पड़ी है,
6454,"राजीव गांधी खेल रत्न 😡 यह है कौन सा खिलाड़ी है जिसके नाम पर खेल रत्न दिए जाते हैं ,🤔",
6455,"राहुल की बकवास सुनना चमचों की मजबूरी है देश की जनता की नहीं ,😜",
6459,लॉक डाउन कोई राहुल गांधी नहीं है जो फेल हो जाएगा 😜,
6461,लोगों को खाने को मिले ना मिले इनकी नेतागिरी चलती रहनी चाहिए,
6463,वैक्सीन आने के बाद कोरोना तो खत्म होगा परन्तु कांग्रेसियों के लिए भी एक वैक्सीन चाहिए,
6465,सब नौटंकी है जो सामान खराब हो गया है उसे चाइना का बताकर रोड पर फेंक दिया,
6471,सोचो अगर राजनीति में राहुल गांधी नहीं होते तो यह राजनीति कितनी boring होती 😂,
6474,हरियाणा वाले केजरीवाल का इलाज दिल्ली में नहीं हो सकता,
6475,हां और तुम्हारा बाप तो बिना किसी जुर्म के जेल में है #TejaswiYadav,
6476,हिंदुस्तान में रहकर भी जो पाकिस्तान की गुलामी करते हैं 😡 यह वही लोग हैं जो अपने घर में बाप होते हुए भी पड़ोसी को पापा कहते हैं 😜😂,
6477,भगवान तूने सब की जोड़ियां बनाई है कोरोना की भी कोई कोरोनी बना देता तो क्या जाता तब देखते कैसे उत्पात मचाता है,
6493,कुछ दिन पहले ही केजरीवाल ने कहा था वो अब सड़क पर उतर कर स्थिति का जायजा लेंगे अभी तक किसी ने देखा केजरीवाल को एक मिनट के.,
6494,काश इस तरह की तस्वीर डॉक्टर से बैठक करते हुए और हॉस्पिटल का राउंड लेते हुए हम चुने हुए मुख्यमंत्री अरविंद केजरीवाल की देखते,
7002,दुःखद समाचार : भारत कोरोना वर्ल्डकप के सेमीफाइनल मे पहुंच गया है। वजह : दिल्ली और महाराष्ट्र के मुख्यमंत्री की जोड़ी.,
7010,चमचो तुमको पतंजलि की ज़रुरत इस लिए नही है क्योंकि इसमें गौमूत्र है। मुझे पता है कि पीढ़ियों से तुम्हें पप्पूमूत्र और कैमलमूत्र का स्वाद लग गया है,
7057,"चीन का विदेशमंत्री खुद कह रहा है कि भारतीय सेना🇮🇳 ने LAC पार करके हमे पेला है लेकिन यहाँ चमचे, मानने को तैयार नही। 🙄",
7721,सुनो तुम और तुम्हारी सहेली ध्यान रखना ये जो चूर्ण है ये कायम चूर्ण के समान है तुम लोगो को तो पहले से हीं दस्त लगे पड़े.,
7723,भंसाली ने दलाली खाकर सुबह से ही मीडिया फ़िल्म देखने के लिए प्रेरित कर रही है. कितने में बिके? 😂,
7726,ये अपने वाले #विश्व_विख्यात इटालियन ब्रांड के #पप्पू के बचपन की अतिदुर्लभ तस्वीर. स्कूल टीचर ने इसे बिल्ली का चित्र बनाने बोला था 🙄🙄 शुक्र है हाथी बनाने नही बोला । नहीं तो हाथी की गर्दन कैसे पकडता ये पप्पू 😹😹😹😹😹😹 👇,
7729,अब तो लगता है #पद्मावत रिलीज हो ही जाए ताकि हिन्दुओ को हिंदुस्तान में अपनी हैसियत का अंदाजा हो जाये. बेकार में उछलकूद करते हैं। शांति से बैठ जाएंगे.😏😏 आतंक का कोई धर्म नहीं होता लेकिन बेवकूफों का होता है. 🙏 मिलार्ड सही हैं 👍,
